name, :description, :address, :photo :user_id
Bambang Pantry,This is the pantry in Barangay Bambang,,/images/pantry1.jpg,1
Matatag Pantry,This is the pantry in Pasig,,/images/pantry2.jpg,1
Magsasaka Partylist Pantry,This is the pantry of the Magsasaka Partylist,,/images/pantry3.jpg,1
Maginhawa2 Pantry,This is the pantry in Pasig inspired by Maginhawa,,/images/pantry4.jpg,1
Community Pantry,This is a community pantry,,/images/pantry5.jpg,1
Shomakers Pantry,This is the pantry near Marikina,,/images/pasig2.jpg,1